{
  "$schema": "./skill-taxonomy-gold.schema.json",
  "schemaVersion": 1,
  "annotation": {
    "mode": "independent-agent-manual-review",
    "humanApproved": false,
    "rubric": "../docs/skill-taxonomy-gold-set.md",
    "labelSetSha256": "78e6b44843fc60d08d1a9cc3fb728fdfec2eccfc35b812064b53342559ba7da1"
  },
  "sampling": {
    "method": "predicted-category-balanced-difficulty-first-stable-hash",
    "seed": "semantic-gold-v1",
    "perPredictedCategory": 10,
    "baseCommit": "de505e1ea95d564f80541d7ad796883da5e9a350",
    "baseCatalogSha256": "b3669c200fc349f792ad07d352f1f81f54a2c01b72c217da14f588a0bb2de0ee",
    "candidateSetSha256": "7765f415e2be2d7b93341dc8192837a06bebb5a9c8fea17ab5c06d8326473267"
  },
  "labels": [
    {
      "skill_id": "agent-browser",
      "expected_category": "apps-workflow-automation",
      "baseline_predicted_category": "ai-agents-orchestration",
      "baseline_resolution_status": "priority-tie",
      "split": "development",
      "rationale": "Its command loop navigates pages, fills forms, and drives repeatable browser workflows.",
      "confidence": "high",
      "reviewers": [
        "reviewer-1",
        "reviewer-4"
      ],
      "review_status": "cross-reviewed",
      "reviewed_at": "2026-07-21",
      "source_sha256": "04afeeb53a8b6ab953974311ec7ed60e0d66c532341ca21933625320f28b01c6"
    },
    {
      "skill_id": "meta-cognition",
      "expected_category": "ai-agents-orchestration",
      "baseline_predicted_category": "ai-agents-orchestration",
      "baseline_resolution_status": "priority-tie",
      "split": "development",
      "rationale": "核心产物是多 Agent 的路由、风险门控与闭环执行协议，而非一般企业战略建议。",
      "confidence": "high",
      "reviewers": [
        "reviewer-2"
      ],
      "review_status": "primary",
      "reviewed_at": "2026-07-21",
      "source_sha256": "686412338738f1039ebafc5e9366856ed04c9b5806124062912931eef1d3ad8d"
    },
    {
      "skill_id": "internal-comms",
      "expected_category": "content-media-publishing",
      "baseline_predicted_category": "ai-agents-orchestration",
      "baseline_resolution_status": "priority-tie",
      "split": "development",
      "rationale": "Produces newsletters, status updates, FAQs, and other internal written artifacts.",
      "confidence": "medium",
      "reviewers": [
        "reviewer-3",
        "reviewer-2"
      ],
      "review_status": "cross-reviewed",
      "reviewed_at": "2026-07-21",
      "source_sha256": "067b7587a344a928fc6534ef66b1bcd591fc7c26d207ea7ca3334aeb678d6475"
    },
    {
      "skill_id": "agent-task-confirm",
      "expected_category": "ai-agents-orchestration",
      "baseline_predicted_category": "ai-agents-orchestration",
      "baseline_resolution_status": "priority-tie",
      "split": "validation",
      "rationale": "核心结果是确认已派发 Agent 的送达、活跃与超时状态，属于 Agent 调度闭环。",
      "confidence": "high",
      "reviewers": [
        "reviewer-4"
      ],
      "review_status": "primary",
      "reviewed_at": "2026-07-21",
      "source_sha256": "146616e547f69b4076c306a6d4676f6038754afc558de7b7e15aac6662c010f7"
    },
    {
      "skill_id": "vcf-annotator",
      "expected_category": "data-analytics-research",
      "baseline_predicted_category": "ai-agents-orchestration",
      "baseline_resolution_status": "priority-tie",
      "split": "development",
      "rationale": "It annotates VCFs with VEP, ClinVar, and gnomAD, then produces ranked variant reports.",
      "confidence": "high",
      "reviewers": [
        "reviewer-1",
        "reviewer-4"
      ],
      "review_status": "cross-reviewed",
      "reviewed_at": "2026-07-21",
      "source_sha256": "3bbfb00254fbf4d46534f24133e7d7b029ddc84cd4d0b35cc9d0c1bc94520dc9"
    },
    {
      "skill_id": "kanbanflow-skill",
      "expected_category": "apps-workflow-automation",
      "baseline_predicted_category": "ai-agents-orchestration",
      "baseline_resolution_status": "priority-tie",
      "split": "development",
      "rationale": "直接操作 KanbanFlow 这一具体 SaaS 的看板与任务，主要结果是应用工作流自动化。",
      "confidence": "medium",
      "reviewers": [
        "reviewer-2",
        "reviewer-1"
      ],
      "review_status": "cross-reviewed",
      "reviewed_at": "2026-07-21",
      "source_sha256": "37fa362a68be4721887c97713cce6eb17526abf8ae9705c7715fe11a05104134"
    },
    {
      "skill_id": "file-organizer",
      "expected_category": "general-utilities",
      "baseline_predicted_category": "ai-agents-orchestration",
      "baseline_resolution_status": "priority-tie",
      "split": "development",
      "rationale": "Organizes local files, detects duplicates, and cleans folders as a general desktop utility.",
      "confidence": "medium",
      "reviewers": [
        "reviewer-3",
        "reviewer-2"
      ],
      "review_status": "cross-reviewed",
      "reviewed_at": "2026-07-21",
      "source_sha256": "a8b91952bab7f73511db68149c4a54672b40699903a8e35ed5044c3e3039ded5"
    },
    {
      "skill_id": "dispatching-parallel-agents",
      "expected_category": "ai-agents-orchestration",
      "baseline_predicted_category": "ai-agents-orchestration",
      "baseline_resolution_status": "override",
      "split": "validation",
      "rationale": "主要指导如何拆分独立任务并并发派发专业 Agent，再审查和整合结果。",
      "confidence": "high",
      "reviewers": [
        "reviewer-4"
      ],
      "review_status": "primary",
      "reviewed_at": "2026-07-21",
      "source_sha256": "76806091c7f923ba2596546b19cccd98a08e57a68745df77c3a7b998fe838e2b"
    },
    {
      "skill_id": "context-recovery",
      "expected_category": "ai-agents-orchestration",
      "baseline_predicted_category": "ai-agents-orchestration",
      "baseline_resolution_status": "rule-match",
      "split": "development",
      "rationale": "It restores compacted agent context from channel history, session logs, and shared memory.",
      "confidence": "high",
      "reviewers": [
        "reviewer-1"
      ],
      "review_status": "primary",
      "reviewed_at": "2026-07-21",
      "source_sha256": "13297b10889d57eeca467a4c16168081e3bf2a580adc66977591604204093f44"
    },
    {
      "skill_id": "clawrouter",
      "expected_category": "ai-agents-orchestration",
      "baseline_predicted_category": "ai-agents-orchestration",
      "baseline_resolution_status": "rule-match",
      "split": "development",
      "rationale": "按请求复杂度在多个 LLM 间路由并控制推理成本，属于模型编排与选择。",
      "confidence": "high",
      "reviewers": [
        "reviewer-2"
      ],
      "review_status": "primary",
      "reviewed_at": "2026-07-21",
      "source_sha256": "ac56e6c5625f557bdd0026928414a05da981708b1827343f15142e3db241a2a5"
    },
    {
      "skill_id": "sp-subagent-driven-development",
      "expected_category": "ai-agents-orchestration",
      "baseline_predicted_category": "software-engineering",
      "baseline_resolution_status": "priority-tie",
      "split": "development",
      "rationale": "Coordinates fresh subagents and review gates; orchestration defines the user workflow.",
      "confidence": "high",
      "reviewers": [
        "reviewer-3",
        "reviewer-2"
      ],
      "review_status": "cross-reviewed",
      "reviewed_at": "2026-07-21",
      "source_sha256": "33a23679d7a7353cb598f16ad86631dfe25b8800145d380573e9500c22956438"
    },
    {
      "skill_id": "git-workflow",
      "expected_category": "software-engineering",
      "baseline_predicted_category": "software-engineering",
      "baseline_resolution_status": "priority-tie",
      "split": "development",
      "rationale": "直接处理 Git 状态、提交、推送、冲突和分支，是典型开发者工具工作流。",
      "confidence": "high",
      "reviewers": [
        "reviewer-4"
      ],
      "review_status": "primary",
      "reviewed_at": "2026-07-21",
      "source_sha256": "f79b57a0359d63ebd29e55ecda73ceac5932bfd92aa68a8b121dc6dace3685b1"
    },
    {
      "skill_id": "gitlab-automation",
      "expected_category": "apps-workflow-automation",
      "baseline_predicted_category": "software-engineering",
      "baseline_resolution_status": "priority-tie",
      "split": "development",
      "rationale": "It performs repeatable GitLab issue, merge-request, pipeline, and branch operations.",
      "confidence": "high",
      "reviewers": [
        "reviewer-1",
        "reviewer-4"
      ],
      "review_status": "cross-reviewed",
      "reviewed_at": "2026-07-21",
      "source_sha256": "ee8116c37964ddb7f700a9e670e4179fefbb1da4dcfb5a891746d2f74540b254"
    },
    {
      "skill_id": "liuyao-yijing",
      "expected_category": "general-utilities",
      "baseline_predicted_category": "software-engineering",
      "baseline_resolution_status": "priority-tie",
      "split": "validation",
      "rationale": "提供六爻起卦与传统易学解读，属于未设专类的垂直领域辅助工具。",
      "confidence": "high",
      "reviewers": [
        "reviewer-2",
        "reviewer-1"
      ],
      "review_status": "cross-reviewed",
      "reviewed_at": "2026-07-21",
      "source_sha256": "e7d94ceb4ed26c83c1bb245b2713137bc70749cbca4fe5c6aafecd1835058aeb"
    },
    {
      "skill_id": "deepwork-tracker",
      "expected_category": "general-utilities",
      "baseline_predicted_category": "software-engineering",
      "baseline_resolution_status": "priority-tie",
      "split": "development",
      "rationale": "Tracks personal focus sessions and renders activity reports as a specialized local utility.",
      "confidence": "medium",
      "reviewers": [
        "reviewer-3",
        "reviewer-2"
      ],
      "review_status": "cross-reviewed",
      "reviewed_at": "2026-07-21",
      "source_sha256": "7ecb04afa361e0a4a5f8adb4a7b932d2991f5983e95f53e979a8b5110be06fcc"
    },
    {
      "skill_id": "claude-code-runner",
      "expected_category": "software-engineering",
      "baseline_predicted_category": "software-engineering",
      "baseline_resolution_status": "priority-tie",
      "split": "validation",
      "rationale": "最终用户结果是以 PTY 执行代码审查、重构、修复和功能开发等编程任务。",
      "confidence": "medium",
      "reviewers": [
        "reviewer-4",
        "reviewer-3"